_id,active,affirmation,extra,fav,flag,folder,image,ord,voice
175,1,"Try to get appointed to strategic planning committees.

Develop systems and work to get them implemented at your organization.",,175,,INTJ,3,175,
176,1,"Seek professional development opportunities.
Sign up for advanced training (or a degree) in your area of specialty.
 Publish research and articles in your field.",,176,,INTJ,5,176,
177,1,"Your work-related strengths may include: 

Ability to focus and concentrate deeply on issues

Ability to see possibilities and implications

Enjoyment of complex theoretical and intellectual challenges",,177,,INTJ,27,177,
178,1,"Your work-related strengths may include:

Single-minded determination to reach your goals even in face of opposition

Confidence and commitment to your vision 

Strong motivation to be competent and excel",,178,,INTJ,4,178,
179,1,"Your work strengths may include:

Ability to work well alone; independent and self-directed

High standards and strong work ethic 

Ability to create systems and models to achieve your objectives ",,179,,INTJ,16,179,
180,1,"Your work strengths may include:

Comfort with technology

Logical and analytical decision-making skills

Decisiveness and strong organizational skills",,180,,INTJ,11,180,
181,1,"As an INTJ , career satisfaction means doing work that:
Lets me work with other conscientious people whose expertise, intelligence, and competence I respect",,181,,INTJ,8,181,
182,1,"I'm in a career that fully uses my creative, analytical and problem solving skills. I have opportunities to explore, research, investigate, innovate and create new things. I have the ability to select, organize and manage my projects and resources to work efficiently in order to achieve my company's goals.  I contribute in real and tangible ways to my company's success. ",,182,,INTJ,25,182,
184,1,I contemplate myself surrounded by the conditions I wish to attract into my life,,184,,Quotes,,184,
185,1,"I am confident in my knowledge, abilities and skills that I have accumulated in my career. I can speak with confidence about these subjects and have risen to a level of mastery in my field.  I love what I do and enjoy continuing my education, gaining new skills and certifications. My company also supports these initiatives. ",,185,,INTJ,,185,
186,1,"But the fruit of the Spirit is love, joy, peace, forbearance, kindness, goodness, faithfulness, gentleness and self-control. Against such things there is no law... Since we live by the Spirit, let us keep in step with the Spirit. Let us not become conceited, provoking and envying each other.
Galatians 5:22-26 NIV",,186,,Faith,,186,
187,0,Every accomplishment starts with the decision to try.,,187,,Confidence,,187,
188,0,"When feeling overwhelmed by a faraway goal, repeat the following: I have it within me right now, to get me to where I want to be later.",,188,,Confidence,,188,
189,0,"Don't wait until everything is just right. It will never be perfect. There will always be challenges, obstacles and less than perfect conditions. So what. Get started now. With each step you take, you will grow stronger and stronger, more and more skilled, more and more self-confident and more and more successful.",,189,,Success,,189,
190,1,"Do nothing out of selfish ambition or vain conceit. Rather, in humility value others above yourselves, not looking to your own interests but each of you to the interests of the others.
Philippians 2:3-4 NIV",,190,,Faith,,190,
191,1,"New opportunities will be available to me which will use my natural skills, talents and abilities to their fullest. Whenever these opportunities arise I will see and have the wisdom to take advantage of them. And at the same time I will seek out ways to create these opportunities for myself and others.",,191,,INTJ,25,191,
192,1,"I will work in a constant state of flow. My mind, attention and energy will be focused and directed to the task at hand. I will feel energized and completely in tune with the knowledge and skills I need to accomplish this work. It will flow smoothly and any challenges will be overcome with ease. The experience I gain will flow into the next set of tasks. ",,192,,INTJ,25,192,
193,1,"My dear brothers and sisters, take note of this: Everyone should be quick to listen, slow to speak and slow to become angry, because human anger does not produce the righteousness that God desires.
James 1:19-20 NIV",,193,,Faith,,193,
194,1,"Be wise in the way you act toward outsiders; make the most of every opportunity.
Colossians 4:5 NIV",,194,,Faith,,194,
195,1,"Let your conversation be always full of grace, seasoned with salt, so that you may know how to answer everyone.
Colossians 4:6 NIV",,195,,Faith,,195,
196,1,"To him who is able to keep you from stumbling and to present you before his glorious presence without fault and with great joy— to the only God our Savior be glory, majesty, power and authority, through Jesus Christ our Lord, before all ages, now and forevermore! Amen.
Jude 1:24-25 NIV",,196,,Faith,5,196,
197,0,I am deeply loved.,,197,,Relationship,,197,
198,0,I will be married to someone who adores me.,,198,,Relationship,,198,
199,0,I will have a husband I can build my life with.,,199,,Health,,199,
200,0,"Don't wait until everything is just right. It will never be perfect. There will always be challenges, obstacles and less than perfect conditions. So what. Get started now. With each step you take, you will grow stronger and stronger, more and more skilled, more and more self-confident and more and more successful.",,200,,Success,,200,
201,0,Success is not the result of making money; making money is the result of success - and success is in direct proportion to our service.,,201,,Success,,201,
202,0,"When feeling overwhelmed by a faraway goal, repeat the following: I have it within me right now, to get me to where I want to be later.",,202,,Positive Thinking,,202,
203,1,"“Lord, do not let us do more if in doing less we might do it better.” E. Lee Phillips",,203,,Faith,2,203,
